### ISSUE TITLE
SNAT for nonlocal traffic from a pod is broken (breaks external DNS resolution)

### ISSUE THREAD

**Issue by jan-g** [oracle/terraform-kubernetes-installer#26]
Cluster set up with a fairly recent (last couple of days) version of the installer.

I am seeing the following:

- for a request from the worker node hosting the kubedns pod:

```
14:10:00.460463 IP 10.0.42.2.39359 > 169.254.169.254.domain: 48005+ A? ioctl.org. (27)
14:10:00.460982 IP 169.254.169.254.domain > 10.0.42.2.39359: 48005 1/13/0 A 94.136.54.223 (254)
```
ie, that’s working.

Traffic on that node that’s targeting the upstream resolver from inside the pod:

```
14:10:03.873217 IP 10.99.38.7.30422 > 169.254.169.254.domain: 38833+ A? registry-1.docker.io. (38)
14:10:03.873263 IP 10.99.38.7.41485 > 169.254.169.254.domain: 40603+ AAAA? registry-1.docker.io. (38)
```

- in other words, it looks to me like upstream resolver traffic is not being correctly SNATted.

In fact, all traffic destined for off the cluster is not NATted correctly:

```
14:17:15.508146 IP 10.99.16.11 > 8.8.8.8: ICMP echo request, id 24576, seq 0, length 64
```
(This a tcpdump of the traffic from a node containing an arbitrary pod pinging that address.)

It looks like the docker-engine systemd configuration is overriding --ip-masq=false (and the other options there). That is, `/usr/lib/systemd/system/docker.service` has the right ExecStart but `/etc/systemd/system/docker.service.d/docker-sysconfig.conf` (which is package-installed) overrides it with (empty) values from `/etc/sysconfig/docker*`

Without the --ipmasq=false setting on dockerd, pod traffic can't correctly get out of the cluster.

**Comment by jlamillan** [comment]
Thanks for the bug report and debugging. I've submitted a fix that is waiting for review.

**Comment by jan-g** [comment]
That patch turns off ipmadq on flanneld also. That will break inter-pod traffic. In particular, many clustering approaches will fail as interpod traffic is incorrectly snatted.

The correct settings should be: off for dockerd, on for flanneld.
